Sr.no,Topic,Difficulty,Question,Answer
1,cassandra,Easy,How would you describe cassandra to someone who only knows sql,Cassandra is a distributed nosql database designed to handle massive amounts of data across many servers unlike sql it has no single point of failure and scales linearly
2,cassandra,Easy,What is the default port for cassandra,9042 for the native transport protocol
3,cassandra,Easy,What is the query language used in cassandra and is it standard sql,Cql cassandra query language and it looks very similar to sql but it doesnt support joins or subqueries
4,cassandra,Easy,How do you log into the cassandra shell,We use the cqlsh command-line interface
5,cassandra,Easy,What is a keyspace,A keyspace is the outermost container for data similar to a database in mysql or postgres it defines how data is replicated across nodes
6,cassandra,Easy,What is a node and a cluster,A node is a single machine running cassandra and a cluster is a collection of nodes that work together as one logical unit
7,cassandra,Easy,How do you see the status of your cluster,I would use the nodetool status command in the terminal
8,cassandra,Easy,Can cassandra work without a network,You can run a single node cluster for development but the whole point of cassandra is its distributed nature over a network
9,cassandra,Easy,What is nodetool describecluster ,It gives you a summary of the cluster showing the name the snitch and the partitioner being used
10,cassandra,Easy,How do you find the version of cassandra you are running,Inside cqlsh it shows at the top or i can run cassandra -v
11,cassandra,Easy,Is cassandra schema less,No it is schema optional for some things but you definitely have to define tables and columns its not like mongodb where you can just throw in any json
12,cassandra,Easy,What is the replication factor,It is the number of copies of data you want to store in the cluster if rf=3 every row is stored on three different nodes
13,cassandra,Easy,What is consistency level,the number of nodes that must acknowledge a read or write for it to be successful common levels are one quorum and all
14,cassandra,Easy,Why is denormalization okay in cassandra,Because disk space is cheap and writes are fast we favor read performance over storage efficiency
15,cassandra,Easy,Can i use aggregates like sum or avg,Yes cassandra supports basic aggregates but they only work efficiently within a single partition running them across the whole table is very slow
16,cassandra,Easy,What is the networktopologystrategy,the replication strategy we use for production it allows us to specify how many replicas we want in each specific data center
17,cassandra,Easy,What is a seed node,Seed nodes are used as contact points for new nodes joining the cluster to discover the ring topology
18,cassandra,Intermediate,Explain the concept of gossip in cassandra,gossip is a peer to peer protocol where nodes talk to each other every second to share state info like who is up who is down and who has joined the ring
19,cassandra,Intermediate,What is the partition key,It is the part of the primary key that determines data distribution all rows with the same partition key are stored together on the same physical node
20,cassandra,Intermediate,What is a clustering key,it is the second part of the primary key it determines the sorting order of the data within a partition
21,cassandra,Intermediate,Can i change my primary key after creating a table,No in cassandra data is physically stored based on the key if you need a new key you have to create a new table and migrate the data
22,cassandra,Intermediate,What is a snitch,A snitch maps the ip addresses of nodes to physical locations like datacenters and racks it helps cassandra avoid placing all replicas on the same rack
23,cassandra,Intermediate,How does cassandra handle a write operation,Actually writes are extremely fast because cassandra writes to a commit log and then a memory structure called a memtable it doesnt wait for a disk seek
24,cassandra,Intermediate,What is hinted handoff in cassandra,If a node is down during a write the coordinator node stores a hint once the target node comes back online the coordinator hands off the missed data
25,cassandra,Intermediate,How do you implement a counter column,You use the counter data type it can only be incremented or decremented you can not manually set it to a specific value
26,cassandra,Intermediate,How do you add a new node to an existing cluster,You install cassandra on the new machine point the seeds to the existing cluster and it will automatically start streaming data to balance itself
27,cassandra,Intermediate,How do you back up data in cassandra,by use the nodetool snapshot command which creates hard links to the current sstables
28,cassandra,Intermediate,Why use cassandra over mongodb,Choose cassandra for high write availability and massive scale across multiple datacenters choose mongodb if you need flexible schemas and complex document queries
29,cassandra,Intermediate,Can i use order by on any column i want in cassandra,No thats a common mistake you can only use order by on clustering columns and even then only within a single partition you can not sort data globally across the whole cluster
30,cassandra,Intermediate,What is the difference between a set and a list in cassandra,A set stores unique values and is unordered a list allows duplicates and preserves order sets are generally more performant because they dont require the internal read before write that lists often do
31,cassandra,Intermediate,How do you change the replication factor of an existing keyspace,I use alter keyspace after that i must run nodetool repair on all nodes to ensure the new replicas are created
32,cassandra,Intermediate,What is the purpose of nodetool drai,It flushes all memtables to disk and stops the node from listening to the network we usually run this before upgrading or stopping the service
33,cassandra,Intermediate,Can cassandra handle updates that increase row size,Yes but internally it just writes a new version of the row the old one is cleaned up later during compaction
34,cassandra,Intermediate,What is the smallest recommended cluster size for production,3 nodes this allows you to have a replication factor of 3 and still maintain a quorum if one node fails
35,cassandra,Advanced,Explain the read path how does cassandra find data across multiple sstables,It checks the memtable first then uses bloom filters and index summaries to quickly narrow down which sstables might contain the data on disk
36,cassandra,Advanced,What is a bloom filter,a memory efficient structure that tells you if a key definitely does not exist in an sstable it saves a lot of unnecessary disk input output
37,cassandra,Advanced,Explain anti entropy repair,it is a process run using nodetool repair that compares merkle trees between nodes to ensure all data is perfectly synchronized
38,cassandra,Advanced,How do you design a table in cassandra do you follow third normal form,Absolutely not in cassandra we use query driven modeling we design the table specifically to satisfy one query even if it means duplicating data
39,cassandra,Advanced,What happens to the data in the memtable,Once the memtable is full it is flushed to the disk into an immutable file called an sstable
40,cassandra,Advanced,Wait if sstables are immutable how do you delete data,cassandra doesnt delete data immediately it writes a marker called a tombstone during compaction the old data and the tombstone are finally purged
41,cassandra,Advanced,What is the commit log,Commit log is a crash recovery mechanism every write is logged there first if the server loses power before the memtable is flushed cassandra replays the commit log to recover data
42,cassandra,Advanced,Explain anti entropy repair,It is a process run using nodetool repair that compares merkle trees between nodes to ensure all data is perfectly synchronized
43,cassandra,Advanced,What is a merkle tree,Merkle tree is a hash tree used to find differences in data between nodes without sending the actual data over the network
44,cassandra,Advanced,What is a materialized view in cassandra, Materialized view is a table that cassandra manages automatically to allow querying the same data with a different Primary Key
45,cassandra,Advanced,What happens if a node stays down for a long time,The hints are deleted you must run a manual nodetool repair once the node comes back to ensure it gets the missed data
46,cassandra,Advanced,What is the jmx interface used for,Jmx interface used for monitoring and managing the cassandra process through tools like jconsole or prometheus
47,cassandra,Advanced,Explain multi dc replication,You can have one cluster span across two different physical datacenters cassandra handles the cross region replication automatically
48,cassandra,Advanced,How do you refresh a table after manually adding an sstable file,I use nodetool import or the older sstableloader tool
49,cassandra,Advanced,What is a custom payload in cql,It is a way for clients to send extra metadata to custom query handlers or triggers on the server side
50,cassandra,Advanced,Does cassandra support acid,It supports atomicity and isolation at the row level but it does not support multi table transactions like a sql database
51,cassandra,Advanced,When should you not use cassandra,If your data is small if you need complex joins or if your query patterns change every day cassandra is for massive predictable workloads
52,core javascript,Easy,How do you write a single-line comment,Using //
53,core javascript,Easy,What does the % (modulus) operator do,It returns the remainder of a division.
54,core javascript,Easy,Which operator is used to concatenate strings,The + operator
55,core javascript,Easy,What method converts a string to uppercase,.toUpperCase()
56,core javascript,Easy,Which function displays a message in a popup window,alert()
57,core javascript,Easy,Which array method removes the last element,.pop()
58,core javascript,Easy,What symbol is used for logical AND,&&
59,core javascript,Easy,Can you redeclare a let variable in the same scope,No
60,core javascript,Easy,Which event occurs when a user clicks an HTML element,onclick
61,core javascript,Easy,How do you create a new Date object,new Date()
62,core javascript,Easy,How do you join two arrays,Using the .concat() method
63,core javascript,Easy,How do you check if a number is even,num % 2 == 0
64,core javascript,Easy,What keyword stops a loop from executing,break
65,core javascript,Easy,What keyword skips the current iteration of a loop,continue
66,core javascript,Easy,How do you remove whitespace from both ends of a string,Using .trim()
67,core javascript,Easy,What is the global object in client-side JavaScript,window
68,core javascript,Easy,What is the data type of true,Boolean
69,core javascript,Easy,How do you check the length of a string str,str.length
70,core javascript,Easy,How do you define a function named myFunc,function myFunc() {  }
71,core javascript,Easy,How do you select an element by its ID,document.getElementById('idName')
72,core javascript,Intermediate,What is Event Bubbling,"When an event happens on an element, it first runs the handlers on it, then on its parent, then all the way up on other ancestors"
73,core javascript,Intermediate,What is the difference between window and document,window is the global object representing the browser tab; document is a property of window representing the loaded HTML content
74,core javascript,Intermediate,How do default parameters work in ES6,You can initialize named parameters with default values if no value or undefined is passed
75,core javascript,Intermediate,What is Array Destructuring,A syntax to unpack values from arrays into distinct variables
76,core javascript,Intermediate,What is the difference between setTimeout and setInterval,setTimeout runs once after a delay; setInterval runs repeatedly at specified intervals
77,core javascript,Intermediate,What is an IIFE (Immediately Invoked Function Expression),A function that runs as soon as it is defined
78,core javascript,Intermediate,How do you check if a specific key exists in an object,"Using the in operator (e.g., ""key"" in obj)"
79,core javascript,Intermediate,What is the difference between array.forEach() and array.map(),map returns a new array; forEach executes a function for side effects and returns undefined
80,core javascript,Intermediate,What is the Temporal Dead Zone (TDZ),"The time between entering a scope and the actual declaration of a let or const variable, during which accessing it throws an error"
81,core javascript,Intermediate,How do you create a Promise,"new Promise((resolve, reject) => {  })"
82,core javascript,Intermediate,What keywords are used to handle errors in JavaScript,"try, catch, finally, and throw"
83,core javascript,Intermediate,What is a module in JavaScript,A file containing code that can export portions of itself (export) and import code from other files (import)
84,core javascript,Intermediate,How do you clone an object (shallow copy) using ES6,Using the spread operator: const copy = { ...original };
85,core javascript,Intermediate,What is the purpose of the class keyword,It provides a cleaner syntax to create objects
86,core javascript,Intermediate,How do you inherit from a class,Using the extends keyword
87,core javascript,Intermediate,What is localStorage limit usually,Approximately 5MB per domain
88,core javascript,Intermediate,Does const make an object immutable,"No, it prevents reassignment of the variable identifier, but the properties of the object can still be changed"
89,core javascript,Intermediate,What is the arguments object,An array-like object accessible inside functions (except arrow functions) that contains the values of the arguments passed
90,core javascript,Intermediate,What is the difference between null and undefined in terms of usage,"undefined is the default value of uninitialized variables; null is a value explicitly assigned to indicate ""no value"""
91,core javascript,Intermediate,How does JSON.parse() work,It converts a JSON string into a JavaScript object
92,core javascript,Advanced,Explain the Event Loop,"A mechanism that handles asynchronous callbacks. It constantly checks if the Call Stack is empty; if so, it pushes tasks from the Callback Queue/Microtask Queue to the stack"
93,core javascript,Advanced,What is the difference between Microtasks and Macrotasks,"Microtasks (Promises, queueMicrotask) have higher priority and run immediately after the current script; Macrotasks (setTimeout, I/O) run in the next loop iteration"
94,core javascript,Advanced,What is a Closure Memory Leak,"When a closure holds a reference to a large variable in an outer scope, preventing the Garbage Collector from freeing that memory even if it's no longer needed"
95,core javascript,Advanced,Explain Prototypal Inheritance vs. Classical Inheritance,Classical inheritance uses classes as blueprints. Prototypal inheritance uses objects linked to other objects (via the prototype chain) to share properties.
96,core javascript,Advanced,What is the difference between __proto__ and prototype,prototype is a property of constructor functions used to build __proto__; __proto__ is the actual reference on an instance object pointing to its prototype
97,core javascript,Advanced,How does the new keyword work internally,"It creates a new object, links its prototype to the constructor's prototype, binds this to the new object, and returns the object"
98,core javascript,Advanced,What is the difference between Promise.all() and Promise.allSettled(),all() rejects immediately if one promise fails; allSettled() waits for all to finish regardless of success or failure
99,core javascript,Advanced,What is a WeakMap,"A collection of key/value pairs where keys must be objects and are ""weakly"" held"
100,core javascript,Advanced,What is a Proxy object,An object that wraps another object and intercepts operations (like reading/writing properties) allowing custom behavior
101,core javascript,Advanced,What is Debouncing,A technique to ensure a function is not called too frequently; it waits for a pause in invocations before running
102,core javascript,Advanced,What is Throttling,A technique to ensure a function is called at most once in a specified time period
103,core javascript,Advanced,What is the purpose of Symbol primitive,"To create unique identifiers, often used for object property keys to avoid name collisions"
104,core javascript,Advanced,How does JavaScript handle integers larger than 2^53 - 1,Using the BigInt data type
105,core javascript,Advanced,What is the Critical Rendering Path,"The sequence of steps the browser takes to convert HTML, CSS, and JS into actual pixels on the screen"
106,core javascript,Advanced,What is a Service Worker,"A script that runs in the background, separate from the web page, enabling features like offline caching and push notifications"
107,core javascript,Advanced,What is a Polyfill,What is a Polyfill
108,core javascript,Advanced,"What is ""Hoisting"" regarding classes","Unlike functions, classes are not hoisted (or rather, they are in the TDZ) and cannot be used before declaration"
109,core javascript,Advanced,What is Tail Call Optimization (TCO),An optimization where the engine reuses the stack frame for the last function call in a function to prevent stack overflow in recursion (supported in strict mode in some engines)
110,core javascript,Advanced,What is a Memory Leak and how do you detect it,"Unwanted memory retention; detected using Chrome DevTools ""Memory"" tab (Heap Snapshots)"
111,core javascript,Advanced,What is the Shadow DOM,"A way to attach a hidden, separate DOM tree to an element, providing encapsulation for CSS and JS (used in Web Components)"
112,django,Easy,What is Django?,"Django is a high-level Python web framework that enables rapid development of secure and maintainable web applications. It follows the batteries-included philosophy by providing built-in features such as authentication, ORM, admin panel, and security mechanisms. Django encourages clean architecture, code reusability, and faster development cycles."
113,django,Intermediate,What architectural pattern does Django follow?,"Django follows the MVT (Model-View-Template) architecture. The Model manages database structure, the View handles business logic, and the Template controls presentation. Although similar to MVC, Django uses different naming conventions while keeping responsibilities clearly separated."
114,django,Easy,What is a Django project and a Django app?,"A Django project is the overall web application containing settings and configurations, while a Django app is a modular component that performs a specific function. Multiple apps can exist within a single project, promoting modular and reusable code."
115,django,Advanced,Explain Django’s request–response lifecycle.,"A request first passes through middleware, then URL routing maps it to a view. The view processes logic, interacts with models, renders a template or response, which again passes through middleware before reaching the client."
116,django,Intermediate,What is Django ORM?,"Django ORM allows developers to interact with databases using Python classes instead of raw SQL. It simplifies database operations, improves security, and supports database portability."
117,django,Easy,What is manage.py used for?,"manage.py is a command-line utility used to run the development server, apply migrations, create superusers, and manage Django applications."
118,django,Advanced,What are Django middlewares and why are they used?,"Middleware processes requests and responses globally. It is used for authentication, session handling, security checks, logging, and other cross-cutting concerns."
119,django,Intermediate,What are Django models?,Django models define database schema using Python classes. Each model maps to a database table and fields represent columns.
120,django,Easy,What is Django Admin?,Django Admin is an automatically generated interface that allows administrators to manage application data with minimal configuration.
121,django,Advanced,How does Django handle database migrations?,"Django migrations track model changes and apply them incrementally to the database schema, ensuring consistency across environments."
122,django,Intermediate,What is a Django view?,A view is a function or class that handles web requests and returns responses containing business logic.
123,django,Easy,What is a URL dispatcher in Django?,The URL dispatcher maps incoming URLs to their respective views using URL patterns.
124,django,Advanced,Explain function-based views vs class-based views.,"Function-based views are simple and straightforward, while class-based views provide reusable, extensible, and object-oriented approaches for complex logic."
125,django,Intermediate,What are Django templates?,Templates define the presentation layer using Django Template Language to render dynamic HTML content.
126,django,Easy,What is settings.py?,"settings.py contains all project configurations such as database settings, installed apps, middleware, and security options."
127,django,Advanced,How does Django ensure security by default?,"Django protects against SQL injection, XSS, CSRF, clickjacking, and password attacks through built-in security features and middleware."
128,django,Intermediate,What is QuerySet in Django?,"A QuerySet represents a lazy collection of database queries allowing filtering, ordering, and aggregation of data."
129,django,Easy,What is CSRF protection in Django?,CSRF protection prevents unauthorized form submissions by using secure tokens.
130,django,Advanced,Explain Django authentication system.,"Django provides a built-in authentication system for managing users, groups, permissions, login, logout, and password security."
131,django,Intermediate,What is INSTALLED_APPS?,INSTALLED_APPS lists all Django apps enabled within the project.
132,django,Easy,What is a superuser in Django?,A superuser is an administrative account with full permissions and access to Django Admin.
133,django,Advanced,How does Django handle static and media files?,"Django manages static files for CSS and JavaScript and media files for user uploads, configured separately for development and production."
134,django,Intermediate,What is pagination in Django?,Pagination splits large datasets into smaller pages to improve performance and user experience.
135,django,Easy,What is urls.py?,urls.py maps URL patterns to corresponding views.
136,django,Advanced,Explain Django signals.,Signals allow decoupled components to communicate by triggering actions when certain events occur.
137,django,Intermediate,What is Django Rest Framework (DRF)?,"DRF is a toolkit for building RESTful APIs with features like serializers, authentication, and permissions."
138,django,Easy,What is a serializer?,A serializer converts Django model instances into JSON and vice versa for API communication.
139,django,Advanced,Difference between select_related and prefetch_related.,"select_related uses SQL joins for foreign keys, while prefetch_related performs separate queries for many-to-many relationships."
140,django,Intermediate,What is Django middleware order?,Middleware executes in the order defined for requests and reverse order for responses.
141,django,Easy,What is Django shell?,Django shell is an interactive environment for testing models and queries.
142,django,Advanced,How does Django handle caching?,"Django supports caching backends like memory, file-based, and Redis to improve performance."
143,django,Intermediate,What is a context processor?,Context processors inject variables globally into templates.
144,django,Easy,What is WSGI?,WSGI defines how web servers communicate with Python web applications.
145,django,Advanced,Explain Django transactions.,Django transactions ensure atomic database operations where all changes succeed or fail together.
146,django,Intermediate,What is Form vs ModelForm?,"Form is manually defined, while ModelForm automatically generates fields from models."
147,django,Easy,What is makemigrations?,makemigrations generates migration files based on model changes.
148,django,Advanced,How does Django handle concurrency?,Django handles concurrency using thread-safe request handling and database transactions.
149,django,Intermediate,What is Django context?,Context is a dictionary of data passed from views to templates.
150,django,Easy,What is DEBUG mode?,DEBUG mode provides detailed error pages during development and must be disabled in production.
151,django,Advanced,How does Django support REST APIs?,Django supports REST APIs mainly through Django Rest Framework with serialization and authentication tools.
152,django,Intermediate,What is database indexing in Django?,Indexing improves query performance by allowing faster data retrieval.
153,django,Easy,What is collectstatic?,collectstatic gathers all static files into one directory for production.
154,django,Advanced,What are Django permissions and groups?,"Permissions control access to actions, while groups assign permissions to multiple users."
155,django,Intermediate,What is a slug field?,A slug field stores URL-friendly text for SEO-friendly URLs.
156,django,Easy,What is ALLOWED_HOSTS?,ALLOWED_HOSTS specifies which domains can serve the Django application.
157,django,Advanced,How do you deploy a Django application?,"Deployment involves configuring a web server, application server, database, static files, and environment variables."
158,django,Intermediate,What is Django testing framework?,"Django provides a testing framework based on unittest for testing models, views, and APIs."
