Sr.no,Topic,Difficulty,Question,Answer
311,core java ,Advanced,If you had to explain JVM to a junior what will you focus on,I will explain memory areas class loading garbage collection and how code actually runs
312,core java ,Advanced,What will happen in this code class Test{ static{ int a=10/0; } } when you run it,Class will fail to load and program will throw ExceptionInInitializerError
313,core java ,Advanced,Explain this code public static void main(String[] args){ try{ return; } finally{ System.out.println(end); } },It will print end because finally always executes even if return is called
314,core java ,Advanced,What will happen in this code class A{ A(){ foo(); } void foo(){ System.out.println(test); } int test=10; },It will print 0 because instance variables are not initialized yet when constructor runs
315,core java ,Advanced,Explain this code Map map=new HashMap map.put(new String(abc) 1) map.put(new String(abc) 2) System.out.println(map.size()),It will print 1 because equals and hashCode treat both keys as same
316,core java ,Advanced,What will happen in this code if two threads modify same HashMap at same time,It can cause data corruption or infinite loop because HashMap is not thread safe
317,core java ,Advanced,Explain this code volatile boolean flag=true while(flag){ } in multithreading context,Thread will not cache value and will always read latest value from memory
318,core java ,Advanced,What will happen in this code ExecutorService service=Executors.newSingleThreadExecutor service.submit(task) service.shutdownNow,Task may stop immediately because shutdownNow interrupts running thread
319,core java ,Advanced,Explain this code synchronized(this){ synchronized(this){ } },It will not deadlock because same thread can acquire same lock multiple times
320,core java ,Advanced,What will happen in this code Object o=new Object synchronized(o){ o.wait(); },Thread will go into waiting state and release the lock
321,core java ,Advanced,Explain this code Object o=new Object o.wait(),It will throw IllegalMonitorStateException because wait must be called inside synchronized block
322,core java ,Advanced,What will happen in this code Thread t=new Thread t.start t.start,It will throw IllegalThreadStateException because thread cannot be started twice
323,core java ,Advanced,Explain this code class Test{ public void finalize(){ System.out.println(clean); } },There is no guarantee when or if finalize will be called by JVM
324,core java ,Advanced,What will happen in this code List list=Collections.unmodifiableList(new ArrayList()) list.add(1),It will throw UnsupportedOperationException because list is read only
325,core java ,Advanced,Explain this code class A{ static int x=10; static{ x=20; } },Final value of x will be 20 because static block runs after variable initialization
326,core java ,Advanced,What will happen in this code String s=new String(hi) s.intern(),It will put string in string pool but s will still point to heap object
327,next javascript,Easy,Which folder typically holds all the routes in the modern App Router,The app directory
328,next javascript,Easy,"In the App Router, what file name is required to make a path publicly accessible",page.js (or page.tsx)
329,next javascript,Easy,How do you define a root layout that applies to the entire application,By creating a layout.js file at the root of the app directory
330,next javascript,Easy,What component is used for client-side navigation between pages,<Link> from next/link
331,next javascript,Easy,What is the default port for a Next.js development server,3000
332,next javascript,Easy,Which component is used to optimize images automatically,<Image /> from next/image
333,next javascript,Easy,"By default, are components in the App Router Server Components or Client Components?",Server Components
334,next javascript,Easy,How do you mark a component as a Client ComponentAdd the directive 'use client' at the top of the file,
335,next javascript,Easy,What is the purpose of the public folder,"It stores static assets like images, fonts, and icons that can be accessed directly via URL"
336,next javascript,Easy,How do you add a global CSS file,Import the CSS file into the root layout.js (or _app.js in Pages router)
337,next javascript,Easy,What file serves as a custom 404 page in the App Router,not-found.js
338,next javascript,Easy,What special file is used to show a loading UI while a route segment loads,loading.js
339,next javascript,Easy,"What is ""Fast Refresh""",A feature that preserves component state while you edit code and updates the UI instantaneously
340,next javascript,Easy,Can you use window or document in a Server Component,"No, because Server Components run only on the server where these browser APIs don't exist"
341,next javascript,Easy,What is the specific file used to handle runtime errors in a route segment,error.js
342,next javascript,Easy,What is the main benefit of the <Script> component over a standard <script> tag,It provides loading strategies (like lazyOnload or beforeInteractive) to optimize performance
343,next javascript,Easy,What HTTP methods correspond to the exported functions in route.js,"GET, POST, PUT, DELETE, etc"
344,next javascript,Easy,How do you programmatically navigate to a different page,Using the useRouter hook (from next/navigation)
345,next javascript,Easy,Can you use React Hooks in Server Components,"No, hooks (like useState, useEffect) generally require the Client runtime"
346,next javascript,Easy,How do you fetch data in a Server Component,By making the component async and using standard fetch
347,next javascript,Intermediate,"Explain ""Parallel Routes","Using ""slots"" (folders starting with @, e.g., @team) to render multiple pages simultaneously in the same layout"
348,next javascript,Intermediate,"What is ""Intercepting Routes""",A way to load a route within the current layout while keeping the URL context
349,next javascript,Intermediate,"What is ""On-Demand Revalidation""",Manually purging the data cache for a specific path or tag using revalidatePath() or revalidateTag()
350,next javascript,Intermediate,How do cookies work in Server Components,You use the cookies() helper from next/headers to read (but usually not set) cookies
351,next javascript,Intermediate,What is the purpose of middleware.ts,"To run code before a request completes, allowing you to modify the response, rewrite, redirect, or check auth headers"
352,next javascript,Intermediate,"How do you achieve a ""Shared Layout"" vs a ""Nested Layout""",Layouts nest by default based on directory structure; shared layouts persist state across page navigation within that subtree
353,next javascript,Intermediate,How do Server Actions change form handling,hey allow you to define async functions running on the server that can be called directly from client-side forms
354,next javascript,Intermediate,What is the purpose of useSearchParams,A Client Component hook to read the query string of the current URL
355,next javascript,Intermediate,"Explain ""Streaming"" in Next.js",Breaking down the page's HTML into chunks and sending them to the client progressively
356,next javascript,Intermediate,What is the Image component's priority prop,"It tells Next.js to preload the image, useful for ""Above the Fold"" LCP (Largest Contentful Paint) elements"
357,next javascript,Intermediate,Can you use getStaticProps and getServerSideProps in the same page file (Pages router),"No, you must choose one rendering strategy per page"
358,next javascript,Intermediate,"How do you handle ""Global State"" in the App Router layout",You must wrap the children in a Client Component that contains the Context Provider
359,next javascript,Intermediate,What is the behavior of <Link> regarding prefetching,"By default, it prefetches routes visible in the viewport to ensure instant navigation"
360,next javascript,Intermediate,What is the difference between headers() and cookies() functions,"Both are read-only in Server Components; headers() reads request headers, cookies() reads request cookies"
361,next javascript,Intermediate,What is the generateMetadata function,An async function in a page.js or layout.js to dynamically fetch and return metadata (SEO tags) based on route params
362,next javascript,Intermediate,How do you define a Robots.txt,By adding a robots.js (or .ts) file in the app directory
363,next javascript,Intermediate,"What is ""Partial Prerendering"" (Experimental)","A hybrid strategy where a shell is served statically while dynamic parts stream in, combining the best of SSG and SSR"
364,next javascript,Intermediate,Where should middleware.ts be placed,In the root of the project (same level as app or pages)
365,next javascript,Intermediate,"What is a ""Route Group""",A folder wrapped in parentheses (groupName) that organizes files without affecting the URL structure
366,next javascript,Intermediate,What is the difference between redirect() and permanentRedirect(),"redirect throws a 307 (temporary); permanentRedirect throws a 308 (permanent), usually for SEO changes"
367,next javascript,Advanced,"Explain the ""Two-Pass Rendering"" (Hydration Mismatch) error",It happens when the initial HTML rendered by the server does not match the HTML rendered by the first client render (common with dates or window usage)
368,next javascript,Advanced,"What is the Next.js ""Data Cache""",A persistent HTTP cache that stores the results of fetch requests across server requests and deployments
369,next javascript,Advanced,"What is the ""Full Route Cache""",A cache that stores the HTML and React Server Component Payload of a route at build time (or during revalidation)
370,next javascript,Advanced,How does router.refresh() work in the App Router,It refreshes the current route by re-fetching the Server Component data from the server without losing client-side state (like input values)
371,next javascript,Advanced,"What is the ""Edge Runtime""",A lightweight runtime (based on Web Standards) that allows Middleware or specific API routes to run closer to the user (CDN edge) with lower latency but limited Node.js API support
372,next javascript,Advanced,Explain the serialization boundary between Server and Client Components,Props passed from Server to Client components must be serializable (JSON-like). You cannot pass functions or class instances
373,next javascript,Advanced,How do you pass a Server Component as a child to a Client Component,You cannot import it directly; you must pass it as a children prop
374,next javascript,Advanced,What is useSelectedLayoutSegment,A hook to read the active route segment one level down from the layout where it is called (useful for active tab styling)
375,next javascript,Advanced,Why shouldn't you access headers() or cookies() in a Root Layout if you want it to be static,"Accessing dynamic request data forces the entire route to switch to Dynamic Rendering (SSR), opting out of static optimization"
376,next javascript,Advanced,"How does Next.js handle ""deduplication"" of fetch requests","If the same fetch call (same URL/options) is made multiple times in a render tree (e.g., in layout and page), Next.js automatically runs it only once (memoization)"
377,next javascript,Advanced,What is the downside of using generateStaticParams with too many paths,It increases build time significantly. It's often better to render popular paths at build time and let obscure ones render on demand
378,next javascript,Advanced,"How do ""Server Actions"" handle security/validation","Since they are public endpoints, you must manually validate user inputs and authorization (just like a standard API route) inside the action"
379,next javascript,Advanced,What is the generateImageMetadata function,"It allows programmatic generation of different versions of images (like Open Graph images) using code (e.g., using ImageResponse)"
380,next javascript,Advanced,How do you support Multi-Tenancy,Using Middleware to rewrite the URL based on the Host header to map subdomains to specific route folders
381,next javascript,Advanced,What is the conflict between getStaticProps and Middleware,"Middleware runs before the cache lookup. If middleware rewrites a path, it might bypass the static file served by getStaticProps or cause cache misses"
382,next javascript,Advanced,"Why might you encounter a ""hydration error"" when using Math.random()","The server generates one number, and the client generates a different one during hydration, causing a mismatch"
383,next javascript,Advanced,What is the typedRoutes experimental feature,"It generates strict TypeScript types for all your application links, preventing dead links at compile time"
384,next javascript,Advanced,What is the difference between npm run build caching vs Data Cache,The build cache (Webpack cache) speeds up the compilation process; the Data Cache stores API/DB responses to speed up user requests
385,next javascript,Advanced,Can you nest a Server Action inside a Client Component,"Yes, you can import a Server Action and pass it to a form or event handler in a Client Component"
386,next javascript,Advanced,"What is the ""RSC Payload""",A binary representation of the rendered Server Components tree sent to the client to update the DOM without invalidating Client Component state
387,node javascript,Easy,command to initialize a new Node.js project,npm init
388,node javascript,Easy,How do you install Express.js in your project,npm install express
389,node javascript,Easy,What function is used to start an Express server,"app.listen(port, callback)"
390,node javascript,Easy,How do you send a JSON response in Express,res.json({ key: 'value' })
391,node javascript,Easy,What is the purpose of node_modules,It contains all the installed dependency packages/libraries
392,node javascript,Easy,How do you export a function named myFunc from a module,module.exports = myFunc; or exports.myFunc = myFunc;
393,node javascript,Easy,How do you read a file asynchronously in Node.js,Using fs.readFile()
394,node javascript,Easy,How do you access environment variables in Node.js,process.env.VARIABLE_NAME
395,node javascript,Easy,What middleware parses incoming JSON payloads,express.json()
396,node javascript,Easy,What is the purpose of the next argument in a middleware function,It passes control to the next middleware function in the stack
397,node javascript,Easy,"What HTTP status code represents ""Not Found""",404
398,node javascript,Easy,"What HTTP status code represents ""Internal Server Error""",500
399,node javascript,Easy,How do you stop a running Node process in the terminal,Ctrl + C
400,node javascript,Easy,How do you import a local file named helper.js,const helper = require('./helper');
401,node javascript,Easy,What is the command to uninstall a package,npm uninstall package-name
402,node javascript,Easy,What is nodemon used for,Automatically restarting the Node application when file changes are detected
403,node javascript,Easy,How do you access the request body in Express,req.body
404,node javascript,Easy,Is require synchronous or asynchronous,Synchronous
405,node javascript,Easy,Which object allows you to access dynamic route parameters,req.params
406,node javascript,Easy,How do you import the http module in Node.js,const http = require('http');
407,node javascript,Intermediate,What is the difference between app.use() and app.get(),"app.use() applies middleware to all requests (or a specific path prefix), whereas app.get() only matches GET requests for a specific route"
408,node javascript,Intermediate,How do you handle 404 errors in Express,Add a middleware function at the very end of the stack that sends a 404 response
409,node javascript,Intermediate,"Explain the concept of ""Error Handling Middleware""","It is a function with 4 arguments: (err, req, res, next). Express recognizes this signature as an error handler"
410,node javascript,Intermediate,Why shouldn't you block the Event Loop,Because Node.js is single-threaded; blocking it prevents the server from handling any other incoming requests
411,node javascript,Intermediate,How do you safely handle secrets (API keys) in Node,Use environment variables (via dotenv package) and never commit .env files to version control
412,node javascript,Intermediate,How do you execute multiple asynchronous tasks in paralle,Using Promise.all()
413,node javascript,Intermediate,What is the purpose of express.Router(),"It creates modular, mountable route handlers (mini-apps) to organize routes into separate files"
414,node javascript,Intermediate,What is the difference between res.send() and res.json(),"res.json() enforces proper JSON headers and formatting, while res.send() automatically detects content type (text/html/json) based on the data"
415,node javascript,Intermediate,"What is a ""Stream"" in Node.js",An abstract interface for working with streaming data
416,node javascript,Intermediate,How does Node.js handle file uploads,Typically using middleware like multer or express-fileupload to handle multipart/form-data
417,node javascript,Intermediate,What is the difference between spawn and exec in the child_process module,"spawn returns a stream (better for large data/long processes), while exec buffers the output and returns it all at once (better for small commands)"
418,node javascript,Intermediate,What is a JWT (JSON Web Token),A stateless way to handle authentication where a signed token is sent to the client and sent back with requests to verify identity
419,node javascript,Intermediate,What is the default timeout for a Node.js HTTP server,"Typically 2 minutes (120,000 ms), but it is configurable"
420,node javascript,Intermediate,"What is the ""Callback Pattern""",Passing a function as an argument to handle the result (error or data) of an asynchronous operation once it completes
421,node javascript,Intermediate,Why do we prefer async/await over callbacks,"It avoids ""Callback Hell"" and makes asynchronous code look and behave more like synchronous code, improving readability"
422,node javascript,Intermediate,What is the difference between dependencies and peerDependencies,dependencies are required to run the app; peerDependencies expect the host project to have a specific version of a package installed (common in plugins)
423,node javascript,Intermediate,How do you connect to a MongoDB database in Node,Typically using the mongoose library or the native mongodb driver
424,node javascript,Intermediate,What happens if you try to res.send twice in the same reques,"Express will throw an error: ""Error: Can't set headers after they are sent"
425,node javascript,Intermediate,How do you structure a large Express application,"MVC Pattern (Model-View-Controller) or separating into routes, controllers, services, and models folders"
426,node javascript,Intermediate,What is Cross-Origin Resource Sharing (CORS),A browser security feature; you handle it in Express using the cors middleware to allow requests from different domains
427,node javascript,Advanced,Explain the Phases of the Node.js Event Loop,Timers -> Pending Callbacks -> Idle/Prepare -> Poll (I/O) -> Check (setImmediate) -> Close Callbacks
428,node javascript,Advanced,"Node.js is single-threaded, but how does it handle file I/O operations concurrently","libuv uses a thread pool (default 4 threads) to handle ""expensive"" tasks like file I/O and crypto off the main thread"
429,node javascript,Advanced,What is the Cluster Module,"A module that allows you to create child processes (workers) that share the same server port, enabling Node to utilize multi-core systems"
430,node javascript,Advanced,"What are ""Worker Threads""","A module (worker_threads) that enables true multi-threading for CPU-intensive JavaScript tasks (unlike Cluster, which splits processes)"
431,node javascript,Advanced,How would you debug a Memory Leak in Node.js,"Using Chrome DevTools ""Memory"" tab (Heap Snapshots), looking for detached objects or huge closures"
432,node javascript,Advanced,What is Backpressure in Streams,When the data buffer fills up faster than the consumer can process it; .pipe() handles this automatically by pausing the readable stream
433,node javascript,Advanced,Difference between Horizontal Scaling and Vertical Scaling in Node,Vertical: Adding more RAM/CPU to the single server. Horizontal: Adding more server instances and using a Load Balancer
434,node javascript,Advanced,"What is a Reverse Proxy (e.g., Nginx) and why use it with Node","It sits in front of Node, handling SSL termination, static files, compression, and load balancing, protecting the Node process"
435,node javascript,Advanced,What is Buffer in Node.js,"A global class to handle binary data (raw memory allocation) directly, necessary because JS originally only handled strings"
436,node javascript,Advanced,"Explain ""Keep-Alive"" in HTTP and how it affects Node","It keeps the TCP connection open for multiple requests, reducing handshake overhead. Node enables this by default in recent versions"
437,node javascript,Advanced,Difference between fork() and spawn(),fork is a special case of spawn specifically for Node processes; it establishes an IPC (Inter-Process Communication) channel between parent and child.
438,node javascript,Advanced,How does Express handle template engines,"Using app.set('view engine', 'pug') and res.render()"
439,node javascript,Advanced,"What is ""Middleware Chaining""",The mechanism where multiple middleware functions are executed in sequence using next(
440,node javascript,Advanced,How do you gracefully shut down a Node server,"Listen for SIGTERM/SIGINT signals, stop accepting new connections (server.close()), finish pending requests, close DB connections, then exit"
441,node javascript,Advanced,What is the difference between TCP and UDP,"TCP is reliable/ordered (HTTP, WebSockets); UDP is fast/unreliable (Video streaming, DNS). Node supports both via net and dgram modules"
442,node javascript,Advanced,"What is a ""Zombie Process""",A child process that has completed execution but still has an entry in the process table
443,node javascript,Advanced,How does Node.js Garbage Collection work,"It uses V8's ""Mark-and-Sweep"" algorithm. It pauses execution (Stop-the-World) to free memory, which is why optimizing memory usage is critical"
444,node javascript,Advanced,"What is ""Event Emitter"" synchronous or asynchronous","Synchronous by default. When you .emit(), all listeners are called immediately in order"
445,node javascript,Advanced,What is the maximum size of a single Buffer in Nod,"On 64-bit systems, it is usually 2GB"
446,node javascript,Advanced,What is REPL,Read-Eval-Print Loop. The interactive shell you get when you type node in the terminal
447,mongodb,Easy,what exactly is mongodb and how is it different from sql,Mongodb is a nosql document oriented database unlike sql which uses tables and rows mongo uses collections and documents the big difference is that its schemaless meaning documents in the same collection dont have to have the same fields
448,mongodb,Easy,What is bson,It stands for binary json it is the format mongodb uses to store data like json but supports more data types like date and bindata and optimized for speed and space
449,mongodb,Easy,How do you start the mongodb shell,in the terminal you just type mongosh to connect to the running instance
450,mongodb,Easy,What is the default port for mongodb,the default port for mongodb is 27017
451,mongodb,Easy,What is a collection in mongodb,A collection is equivalent to a table in rdbms it is a group of mongodb documents
452,mongodb,Easy,How do you see all the databases on your server,Just type show dbs
453,mongodb,Easy,What command do you use to insert a single document,db.collection.insertOne({ ... })
454,mongodb,Easy,What is the id field,It is a unique identifier for every document if you dont provide one mongodb automatically generates an objectid for you
455,mongodb,Easy,How do you find a document where the name is Barrel,"db.users.find({ name: ""Barrel"" })"
456,mongodb,Easy,What is the 16mb limit,A single bson document in mongodb cannot exceed 16 megabytes
457,mongodb,Easy,What are roles in mongodb,They define permissions for examples read readwrite and dbadmin
458,mongodb,Easy,What is the mongod process,It is the primary daemon process for the mongodb system the server itself
459,mongodb,Easy,How do you check server status,db.serverStatus()
460,mongodb,Easy,What is mongodb atlas,mongodb atlas is the fully managed cloud version of mongodb provided as a service
461,mongodb,Easy,What is the use of push operator,It appends a new value to an array
462,mongodb,Easy,What is the use of pop,It removes either the first or the last element from an array
463,mongodb,Easy,How to rename a collection,"db.collection.renameCollection(""new_name"")"
464,mongodb,Intermediate,What is the difference between find and findone function,find returns a cursor to all matching documents while findone returns the actual first document that matches the criteri
465,mongodb,Intermediate,How do you update a specific field without overwriting the whole document,by use the set operator if you dont use set mongodb will replace the entire document with your new input
466,mongodb,Intermediate,How do you sort results in mongodb,Using the sort method Pass 1 for ascending and -1 for descending
467,mongodb,Intermediate,Explain projection in mongodb,Projection is used to select only the fields you need
468,mongodb,Intermediate,What are comparison operators in mongo,gt greater than lt less than gte greater or equal and ne not equal
469,mongodb,Intermediate,What does $match do in aggregation,It filters the documents similar to the find query or the where clause in sql it is best to put it at the start of the pipeline
