Sr.no,Topic,Difficulty,Question,Answer
470,mongodb,Intermediate,Can you sort inside an aggregation,yes using the operator $sort stage
471,mongodb,Intermediate,What is the primary node,The node that receives all write operations by default it also handles all reads unless configured otherwise
472,mongodb,Intermediate,Difference between vertical and horizontal scaling,Vertical is adding more ram and cpu to one server and  horizontal is adding more servers mongodb scales horizontally via sharding
473,mongodb,Intermediate,How do you handle one to many relationships,Either by nesting an array of sub documents or by storing the id of the parent in the child document
474,mongodb,Intermediate,How do you create a backup in mongodb,Using the mongodump utility to restore it you use mongorestore
475,mongodb,Intermediate,How do you find the current operations running on a server,db.currentOp()
476,mongodb,Intermediate,How do you update an item inside an array by its index,Using the dot notation like tags.0 to target the first item
477,mongodb,Intermediate,What is the size operator,It matches documents where an array is exactly a certain size
478,mongodb,Intermediate,What is the $regex operator,It allows you to search for strings using regular expressions
479,mongodb,Intermediate,How to count unique visitors,Use a Set and $addtoset with user ids or use an aggregation pipeline with $group
480,mongodb,Intermediate,How would you handle a search feature for blog posts,I would create a text index on the title and content fields and use the $text operator
481,mongodb,Advanced,Why indexes are important in mongodb,Without them mongodb has to do a collection scan indexes store a small portion of the data in a traversable form to speed up searches
482,mongodb,Advanced,What is a compound index,Compound index is an index on multiple fields
483,mongodb,Advanced,Explain covered queries,A query is covered if the index contains all the fields requested by the query mongodb doesnt even need to look at the documents themselves
484,mongodb,Advanced,What is a TTL Index,Time to live index it automatically removes documents from a collection after a certain amount of time
485,mongodb,Advanced,Can you index an array field,Yes thats called a multikey index mongodb creates an index entry for every element in the array
486,mongodb,Advanced,What is the aggregation pipeline,Aggregation pipeline is a framework for data processing you pass documents through stages like $match $group and $sort to transform them into a final result
487,mongodb,Advanced,What is the $unwind stage,If a document has an array $unwind breaks it into multiple documents one for each element in the array this lets you run operations on individual array items
488,mongodb,Advanced,How to implement a global search across all collections,Mongodb doesnt support this natively you would either need to aggregate results in the app or use atlas Search
489,mongodb,Advanced,How do you handle concurrency when two users update the same document,Mongodb uses optimistic locking we can also implement a version field or use atomic operators like $set to ensure one doesnt wipe the other
490,mongodb,Advanced,A user changes their username how do you update it across the app,If i referenced the user id i only update the user document if i embedded the username everywhere I would  have to run an updatemany across multiple collections
491,mongodb,Advanced,What is the $expr operator,It allows you to use aggregation expressions within a regular query like comparing two fields in the same document
492,mongodb,Advanced,What is the positional operator,Positional operator is used in an update to identify the specific element in an array that matched your query filter
493,mongodb,Advanced,What is journaling,It is a log that helps mongodb recover in case of a crash by keeping track of data changes before they are written to the data files
494,mongodb,Advanced,What is polymorphic schema,when documents in a collection have different structures but represent the same general entity
495,mongodb,Advanced,Is mongodb acid compliant,Yes since version 4.0 mongodb supports multi document transactions with acid properties
496,mongodb,Advanced,Can you join three collections,Yes by chaining multiple $lookup stages in an aggregation pipeline
497,mongodb,Advanced,Why is mongodb called scalable,Because of sharding you can keep adding cheap commodity hardware to a cluster to handle more data and traffic without a single massive server
498,postgresql,Easy,Lets start with the basics what exactly is PostgreSQL,Postgresql often called Postgres is an advanced open source object relational database management system its known for its reliability and its ability to handle complex data workloads
499,postgresql,Easy,What is the primary difference between a primary key and a unique key,a table can have only one primary key and it cannot be null a unique key allows for null values and you can have multiple unique keys in one table
500,postgresql,Easy,What data type would you use for a true false value,The boolean data type
501,postgresql,Easy,How do you add a new column to an existing table,Using the alter table command
502,postgresql,Easy,What command is used to delete all records from a table without deleting the table itself,You can use truncate or delete
503,postgresql,Easy,How do you sort the results of a query,Using the order by clause followed by asc for ascending or desc for descending
504,postgresql,Easy,What is the difference between varchar and text in Postgres,In Postgres there is no performance difference varchar n has a limit while text is for strings of unlimited length
505,postgresql,Easy,What is the like operator used for,it used for pattern matching for example where name like a% finds all names starting with a
506,postgresql,Easy,What is the difference between delete and drop,delete removes rows from a table drop removes the entire table structure from the database
507,postgresql,Easy,How do you handle case insensitive text searching,I can use the ilike operator instead of like or use the lower function on the column
508,postgresql,Easy,What is the difference between rollback and abort,in postgres they are synonyms both will cancel the current transaction and discard all changes
509,postgresql,Easy,How do you check the version of the postgres server,Using the query select version
510,postgresql,Easy,What is the default port for Postgres,The default port is 5432
511,postgresql,Easy,How do you log into the postgres command line interface,We use the command line tool called psql
512,postgresql,Easy,if i am inside psql how do i list all the tables in my database,You just use the shortcut command \dt
513,postgresql,Easy,What is the search path,Its a setting that tells Postgres which schemas to look in when you reference a table without a schema prefix
514,postgresql,Easy,What is postgis,Its the most famous postgres extension it adds support for geographic objects allowing you to run locationbased queries
515,postgresql,Intermediate,Explain the difference between inner join and left join, inner join returns rows only when there is a match in both tables left join returns all rows from the left table even if there are no matches in the right table
516,postgresql,Intermediate,What is a schema in postgresql,A schema is a namespace that contains named objects like tables views and indexes its a way to organize database objects into logical groups
517,postgresql,Intermediate,How do you prevent duplicate entries in a column that isnt a Primary Key,By applying a unique constrain to that column
518,postgresql,Intermediate,What is an aggregate Function,These functions perform a calculation on a set of values and return a single value
519,postgresql,Intermediate,How do you filter results based on an aggregate function like show departments with more than 10 employees,You must use the having clause after the group by because where cannot be used with aggregate functions
520,postgresql,Intermediate,What is a foreign key,its a column that creates a link between data in two tables it ensures referential integrity by pointing to a primary key in another table
521,postgresql,Intermediate,Does Postgres support json data,Yes it has excellent support for json and jsonb jsonb is the binary version which is faster to process and supports indexing
522,postgresql,Intermediate,What is a view,A view is essentially a stored query it acts like a virtual table that you can query but it doesnt store the data itself
523,postgresql,Intermediate,What is an index and why should we use it,An index is a structure that speeds up data retrieval without it postgres has to do a sequential scan which is very slow for large tables
524,postgresql,Intermediate,Then what is a composite index,Its an index created on multiple columns at once its very useful if your where clause frequently filters by those specific columns together
525,postgresql,Intermediate,How do you start and finish a transaction in postgres,You start with begin and end with commit if something goes wrong you use rollback
526,postgresql,Intermediate,What is a trigger,A trigger is a function that automatically runs when a specific event occurs like an insert update or delete on a table
527,postgresql,Intermediate,What is coalesce,Its a function that returns the first non null value in a list great for setting default values
528,postgresql,Intermediate,How do you back up a postgres database,The most common way is using the pg_dump utility
529,postgresql,Intermediate,How do you find the size of a table,Using the function pg_total_relation_size('table_name')
530,postgresql,Intermediate,What is an array data type in postgres,Postgres allows a column to store an array of values you would use it for things like tags on a blog post so you dont always need a separate mapping table
531,postgresql,Intermediate,What is the difference between a row level lock and a table level lock,A row level lock only blocks other transactions from modifying specific rows a table level lock blocks the entire table
532,postgresql,Advanced,What is the effective cache size setting,Its a hint to the query planner about how much memory is available for disk caching by the operating system
533,postgresql,Advanced,Can postgres handle millions of connections,Not natively because each connection is a process to handle that many you must use a connection pooler like pgbouncer
534,postgresql,Advanced,What is the lateral join,Its like a foreach loop in sql it allows a subquery to refer to columns provided by preceding form items
535,postgresql,Advanced,Can I join two tables from two different Postgres databases,Yes by using the postgres_fdw extension it allows you to access external tables as if they were local
536,postgresql,Advanced,How do you identify the slowest queries in your database,I would use the pg_stat_statements extension it tracks execution statistics for all queries run on the server
537,postgresql,Advanced,What is streaming replication,It is a method where the primary server sends wal records to the standby server in real time to keep them in sync
538,postgresql,Advanced,What is the purpose of commit prepared ,Its used for two phase commit which allows a transaction to be prepared on one server and committed later often across multiple databases
539,postgresql,Advanced,What is row level security,It is a security feature where you can define policies so that users can only see specific rows
540,postgresql,Advanced,Explain the isolation levels in postgres,There are four read uncommitted read committed repeatable read and serializable they control how visible changes from other transactions are
541,postgresql,Advanced,What is the maximum size of a single row in postgres,Technically its 1.6 tb but individual fields are limited to 1 gb via a mechanism called toast
542,postgresql,Advanced,What is toast,Toast is how postgres handles large values it compresses them or moves them to a separate side table so the main table stays lean
543,postgresql,Advanced,What is a brin index and when should i use it,Brin stands for block range index it is designed for very large tables where the data is naturally sorted it is much smaller than a b tree index
544,postgresql,Advanced,What is a cte,cte stands for common table expression it is a temporary result set defined using the with clause it makes complex queries much more readable than using subqueries
545,postgresql,Advanced,Can a cte be recursive,Yes recursive ctes are great for querying hierarchical data like an organizational chart or a family tree
546,postgresql,Advanced,What if two people have the same salary how do you handle ties in ranking,In that case i would use window functions like rank function or dense rank function they allow you to rank rows within a partition of a result set
547,postgresql,Advanced,What is replication,it is the process of copying data from a master server to one or more replica servers for load balancing or backup
548,postgresql,Advanced,Great final question if you could only use one tool to monitor postgres what would it be,I would say pgadmin for a gui experience or pg stat activity for direct real-time insights
549,core python,Easy,What is Python and why is it so popular?,"Python is a high-level, interpreted programming language known for its simple and readable syntax. It allows developers to write fewer lines of code compared to many other languages, which makes development faster and easier. Python is popular because it supports multiple programming paradigms like procedural, object-oriented, and functional programming. It also has a huge ecosystem of libraries for web development, data science, automation, AI, and more."
550,core python,Intermediate,What is the difference between a list and a tuple in Python?,"The main difference between a list and a tuple is mutability. Lists are mutable, meaning their elements can be changed after creation, while tuples are immutable and cannot be modified once created. Lists are generally used when data needs to be changed frequently, whereas tuples are preferred for fixed data and offer slightly better performance and safety."
551,core python,Easy,How do you comment code in Python?,"In Python, single-line comments are written using the # symbol. Anything after # on that line is ignored by the interpreter. For multi-line documentation, Python uses triple quotes which are commonly used for docstrings to describe functions, classes, or modules."
552,core python,Advanced,Explain Python’s memory management system.,"Python manages memory automatically using a private heap space where all objects are stored. The Python memory manager handles allocation and deallocation. Reference counting is used as the primary technique, where an object is removed when its reference count drops to zero. Additionally, Python has a cyclic garbage collector to clean up reference cycles that reference counting alone cannot handle."
553,core python,Intermediate,What is a Python dictionary and how does it work internally?,"A dictionary is a mutable data structure that stores key-value pairs. Internally, dictionaries use a hash table which allows fast lookup, insertion, and deletion. Each key is hashed to determine where the value is stored. This is why dictionary keys must be immutable and hashable, like strings or tuples."
554,core python,Easy,What are variables in Python?,"Variables in Python are names that refer to objects stored in memory. Python does not require explicit type declarations; the type is inferred at runtime. Variables can reference different data types at different times, making Python dynamically typed."
555,core python,Intermediate,What is the difference between == and is?,"The == operator checks value equality, while is checks object identity in memory. Two objects may have the same value but still be stored at different memory locations."
556,core python,Easy,What are Python keywords?,"Python keywords are reserved words that have predefined meanings and cannot be used as identifiers. Examples include if, else, for, while, def, and class."
557,core python,Advanced,What are generators and how are they different from lists?,"Generators produce values one at a time using the yield keyword instead of storing them in memory. This makes them more memory-efficient than lists, especially for large datasets."
558,core python,Intermediate,What is slicing in Python?,"Slicing extracts a portion of a sequence using start, end, and step values. It returns a new sequence without modifying the original."
559,core python,Easy,How do you take user input in Python?,Python uses the input() function to read input from the user. The returned value is always a string and may require type conversion.
560,core python,Intermediate,What is exception handling in Python?,"Exception handling allows programs to catch and handle runtime errors using try, except, else, and finally blocks, preventing crashes."
561,core python,Advanced,Explain the Global Interpreter Lock (GIL).,"The GIL ensures that only one thread executes Python bytecode at a time in CPython, simplifying memory management but limiting CPU-bound parallelism."
562,core python,Easy,What is indentation and why is it important?,Indentation defines code blocks in Python and is mandatory. Incorrect indentation leads to syntax errors or logical issues.
563,core python,Intermediate,What are lambda functions?,"Lambda functions are small anonymous functions defined using the lambda keyword. They are used for short, simple operations."
564,core python,Advanced,What is monkey patching?,"Monkey patching modifies classes or modules at runtime. While powerful, it can make code harder to maintain and debug."
565,core python,Easy,What is a function in Python?,A function is a reusable block of code defined using def. It helps reduce repetition and improve code organization.
566,core python,Intermediate,Difference between append() and extend()?,"append() adds a single element to a list, while extend() adds elements from another iterable."
567,core python,Advanced,What are metaclasses?,Metaclasses control class creation. They define how classes behave and are mainly used in advanced frameworks.
568,core python,Easy,What data types are built into Python?,"Python includes int, float, str, list, tuple, set, and dict as built-in data types."
569,core python,Intermediate,What is list comprehension?,List comprehension provides a concise way to create lists using expressions and optional conditions.
570,core python,Advanced,Difference between shallow copy and deep copy?,"Shallow copy duplicates references, while deep copy creates independent objects recursively."
571,core python,Easy,What does len() do?,len() returns the number of items in a sequence or collection.
572,core python,Intermediate,What are modules and packages?,"Modules are single Python files, while packages are collections of modules organized in directories."
573,core python,Advanced,How does Python handle multithreading?,"Python supports threading, but due to the GIL, it is best suited for I/O-bound tasks rather than CPU-bound tasks."
574,core python,Easy,What is print() used for?,print() outputs data to the console for display or debugging.
575,core python,Intermediate,What is *args and **kwargs?,"*args allows variable positional arguments, while **kwargs allows variable keyword arguments."
576,core python,Advanced,Explain Python decorators.,"Decorators modify the behavior of functions without changing their code, commonly used for logging or authorization."
577,core python,Easy,What is a boolean?,A boolean represents True or False values used in logical operations.
578,core python,Intermediate,Difference between break and continue?,"break exits the loop, while continue skips the current iteration."
579,core python,Advanced,What is Python MRO?,Method Resolution Order defines the order in which Python searches for methods in inheritance.
580,core python,Easy,What is a string?,A string is an immutable sequence of characters enclosed in quotes.
581,core python,Intermediate,What is the with statement?,The with statement simplifies resource management by automatically handling setup and cleanup.
582,core python,Advanced,What is serialization?,Serialization converts objects into a storable or transferable format like JSON or pickle.
583,core python,Easy,What does type() do?,type() returns the data type of an object.
584,core python,Intermediate,What is recursion?,"Recursion is when a function calls itself to solve smaller subproblems, requiring a base case."
585,core python,Advanced,Explain closures.,Closures are functions that remember variables from their enclosing scope even after execution.
586,core python,Easy,What is None?,None represents the absence of a value in Python.
587,core python,Intermediate,What are sets?,Sets are unordered collections of unique elements useful for membership testing.
588,core python,Advanced,What is duck typing?,"Duck typing focuses on behavior rather than type; if an object behaves correctly, it is accepted."
589,core python,Easy,What is an interpreter?,"An interpreter executes code line by line, enabling easier debugging."
590,core python,Intermediate,Difference between sort() and sorted()?,"sort() modifies the list in place, while sorted() returns a new sorted list."
591,core python,Advanced,What is Python bytecode?,Bytecode is an intermediate representation executed by the Python Virtual Machine.
592,core python,Easy,What is a loop?,A loop repeatedly executes code while a condition is met.
593,core python,Intermediate,What is a virtual environment?,A virtual environment isolates project dependencies to avoid conflicts.
594,core python,Advanced,Explain async and await.,"async and await enable asynchronous, non-blocking execution for I/O-bound tasks."
595,core python,Easy,What does pass do?,pass is a placeholder statement that does nothing.
596,core python,Intermediate,What is file handling?,File handling involves reading and writing files using Python functions.
597,core python,Advanced,What is dependency injection?,Dependency injection provides dependencies externally to improve modularity and testability.
598,core python,Easy,Why is Python beginner-friendly?,Python’s simple syntax and large ecosystem make it easy for beginners to learn and use.
599,pytorch,Easy,What is PyTorch?,"PyTorch is an open-source deep learning framework developed by Facebook AI Research. It is primarily used to build, train, and deploy neural networks. One of its biggest strengths is its dynamic computation graph, which allows developers to define and modify models during runtime. PyTorch integrates seamlessly with Python, making debugging intuitive. It also provides strong GPU acceleration and a large ecosystem, which makes it suitable for both research and production use cases."
600,pytorch,Intermediate,What is a tensor in PyTorch?,"A tensor is the core data structure in PyTorch and represents a multi-dimensional array similar to NumPy arrays. However, PyTorch tensors support automatic differentiation and GPU acceleration. Tensors store input data, model parameters, intermediate computations, and gradients during training, making them central to deep learning workflows."
601,pytorch,Easy,How is PyTorch different from NumPy?,"PyTorch tensors resemble NumPy arrays but add automatic differentiation through autograd and support GPU execution. These features make PyTorch suitable for deep learning, while NumPy is primarily used for CPU-based numerical computation."
602,pytorch,Advanced,Explain PyTorch’s dynamic computation graph.,"PyTorch builds computation graphs dynamically during runtime. This allows control flow such as loops and conditionals inside the model’s forward pass. Dynamic graphs improve flexibility, make debugging easier, and are well-suited for research and experimental architectures."
603,pytorch,Intermediate,What is autograd in PyTorch?,"Autograd is PyTorch’s automatic differentiation engine. It records tensor operations during the forward pass and computes gradients automatically during backpropagation using the chain rule, eliminating manual gradient calculations."
604,pytorch,Easy,How do you create a tensor in PyTorch?,"Tensors can be created using torch.tensor(), torch.zeros(), torch.ones(), torch.randn(), or by converting NumPy arrays into tensors. These methods allow flexible initialization depending on the use case."
605,pytorch,Advanced,How does PyTorch handle backpropagation internally?,"PyTorch records all operations in a computation graph during the forward pass. When backward() is called, it traverses the graph in reverse and computes gradients using the chain rule, storing them in the .grad attribute of leaf tensors."
606,pytorch,Intermediate,What is the difference between requires_grad and torch.no_grad()?,"requires_grad enables gradient tracking for training, while torch.no_grad() disables it for inference. This reduces memory usage and improves performance during evaluation."
607,pytorch,Easy,What is a PyTorch model?,"A PyTorch model is typically a class inheriting from nn.Module. It defines layers in the constructor and specifies data flow in the forward method, making models modular and reusable."
608,pytorch,Advanced,What are leaf tensors in PyTorch?,"Leaf tensors are user-created tensors with requires_grad=True. Gradients are stored only for leaf tensors after backpropagation, which is important for parameter updates."
609,pytorch,Intermediate,What is nn.Module?,"nn.Module is the base class for all neural network components in PyTorch. It manages parameters, supports device transfers, and enables saving and loading models."
